Country,Date,Rating,Review,Version
Great Britain,05/03/2020,width: 39%;,"Really frustrated today to have booked an appointment for 11:20, sat waiting for the call from the consultant for half an hour and no call and then only by digging around do I find that it has been cancelled. In this current climate of COVID-19, especially as my throat is very sore, some notice or notification of this being cancelled and why, would be helpful. I now can’t get an appointment for another six hours!  Frustrating.  Otherwise, generally helpful to have this service, let down by irritations such as this.",4.20.3
Great Britain,05/02/2020,width: 39%;,"The app is very useful but there is appears to be no feedback mechanism to report bugs so I’m resorted to leaving a bug report in this review!

When in the ‘Me’ section and I tap on ‘Memebership’ and then ‘Insurance Details’ I get an error message popping up asking my to check my internet connection (which is working fine).  If I attempt to add any information it can’t be saved as the same error pops up again and again.  If I try to select ‘Company Name’ I can’t as it’s greyed out and cannot be selected...",4.20.3
Great Britain,05/02/2020,width: 39%;,"3 calls. First one, video call bugs out. Doctor doesn’t think to call me on cellphone. Second one, do it via call so no bug but doctor can’t see or request an imagine of a script I already have. Third call rescheduled. Poor experience.",4.20.3
Great Britain,05/01/2020,width: 19%;,"I have had their £9.99 monthly subscription for almost most 14 months. I was paying this for myself and another subscription for my wife, and a third for my son. All totalled to almost £30 a month for the three of us. 

And what do we get? Nothing, apart from the fact that they are 30 to 40% of the time respond to appointments late, they have never prescribed a medication and pretty much anything they say, can be easily found on medical websites like Webmd or Mayoclinic.  No referrals, no prescriptions, nothing. Avoid at all cost.",4.20.3
Great Britain,04/30/2020,width: 19%;,Poor quality app,4.20.3
Great Britain,04/30/2020,width: 19%;,Every time I login via Facebook since the latest update I get “an unexpected error occurred” and I am unable to use the app.,4.20.3
Great Britain,04/30/2020,width: 99%;,"Wow wow wow, the perfect service for lazy hypercondriacts! Also amazing staff and 24/hour care ! :)",4.20.3
Great Britain,04/29/2020,width: 99%;,Many thanks great service,4.20.3
Great Britain,04/28/2020,width: 99%;,"First time using the Babylon app, we are a Bupa customer. Babylon customer support was very helpful in sorting some problems with the app setup. Our first call to the GP was great, very helpful even though we could not see the GP on video he could see us. Great app and service!!",4.20.3
Great Britain,04/28/2020,width: 99%;,This is the best service I could wish for!,4.20.3
Great Britain,04/27/2020,width: 19%;,"Terrible. Impossible to get repeat predictions set up (they want to keep making you book appointments) and you only get a 3 day window between scrips so if your can’t get to the chemist, well that’s just too bad. Now need to figure out how to get a proper GP instead of this investor focussed non patient-centric rubbish.",4.20.3
Great Britain,04/26/2020,width: 19%;,"First day using it. We had an appointment scheduled for 3.50 this afternoon and haven’t heard anything, and that was over an ago from now.

Will just have to use our regular GP instead. This app did nothing for us except waste our time.",4.20.3
Great Britain,04/25/2020,width: 59%;,"This app needs to consider what it calls healthy... using body mass index to call people overweight is unfair to muscular individuals with a low body fat percentage, who are fitter / healthier than most. Also, eating whole grains is not a marker of a good diet, especially if individuals are gluten sensitive or choose to avoid it.",4.20.3
Great Britain,04/24/2020,width: 19%;,"Love the idea of this app/service, however the app doesn’t work correctly and make sure you read the T&Cs carefully!

The appointment time’s tend to be very early in the morning or very late at night. After staying up until 11pm using the app for the first time for an appointment, the video service would not work and the doctor could see me but I couldn’t see them. I therefore had to arrange another appointment for early in the morning the next day. Where the same problem occurred. I manage to replay the video call after the appointment in the history, however the live functionality failed.

Due to the bad experience I decided to cancel my annual subscription and requested a refund. A refund was not possible as I was out of the 14 day cancellation policy, therefore I asked customer services to reinstate my membership for the remaining of the year, that I paid for. Please see their reply below:

“Unfortunatley, we cannot reinstate your service once you downgrade your membership. 

In our Terms and conditions, it states that access instantly stops once subsciptions are downgraded to pay as you go.”",4.20.3
Great Britain,04/24/2020,width: 99%;,I travel a lot for work and it’s difficult to get medical advice while traveling in foreign countries. The app has been exactly what I need when I’m traveling and if I get sick. The Doctors and staff are very helpful and give useful advice. I strongly recommend this app.,4.20.3
Great Britain,04/24/2020,width: 39%;,Very helpful. Love it,4.20.3
Great Britain,04/24/2020,width: 99%;,"Amazing that I can easily book appointments through the app, within 30 mins sometimes! Always same day at least. Booked a follow-up appointment for later in the day too when I needed a blood test. 10x improvement from experience before - having to call and then wait weeks for an appointment.",4.20.3
Great Britain,04/24/2020,width: 19%;,"I must to have my treatment very urgently, I wasted a lot of time with Babylon service and finally I didn't have a simple prescription. 

without understanding my state of health

Very bad service!!",4.20.3
Great Britain,04/23/2020,width: 19%;,"Signed up to this app via my company, I used it once and it went really well, spoke to a GP and was prescribed medication. On my way to pick up my medication the app suddenly close and logged me out I attempted to log back in but it didn’t recognise my password so I initially thought I have forgotten it, well that wasn’t the case so I requested for a password reset but it didn’t send my a reset to the email I had used to sign up, so I am assuming it has deleted my whole profile. I wouldn’t have been so annoyed if I had been able to collect my medication as I couldn’t show proof as they didn’t have a prescription for me.",4.20.3
Great Britain,04/23/2020,width: 99%;,"Can’t fault the company and service, so handy to be able to speak to a gp  as when required, have been faultless and so helpful",4.20.3
Great Britain,04/22/2020,width: 99%;,"After hurting myself I used the Babylon app to book a appointment with a doctor via video conferencing. Within a hour I was contacted and warned by text message 10 minutes beforehand. The service was remarkable and efficient. After being assessed , an online prescription was ready  for me to collect at my local pharmacy. The all experience was very reassuring and I cannot recommend high enough the service. Especially during time of pandemic. Very professional and well designed application.",4.20.3
Great Britain,04/22/2020,width: 99%;,Love this app! The service is amazing and the fact you can get an appointment at a time that suits you is brilliant. Really good call and worked well. Amazing!!,4.20.3
Great Britain,04/22/2020,width: 99%;,"I am so happy with this app, I am in London and I can book, amend, cancel appointments and order repeat medicine all from the app no call centre just this app. Video or phone calls, both available and sufficient. In person appointment is recommended but this can be done via a video call if like me, you are busy at work. I am on the free service and I would give it 5 out of 5.",4.20.3
Great Britain,04/21/2020,width: 99%;,"This is infinitely better than being registered with a local GP. I’ve been wanting to make the switch to Babylon for some time and COVID-19 has meant I finally took the plunge. Signing up was straight forward and once complete I booked an appointment for half an hour later. I wrote my symptoms down and was connected with a nurse who spoke to me for 10 minutes, was very professional and kind and gave good advice. Afterwards I had access to the notes she made during the call, and links to more information about my issue. I’m so impressed and feel that this will completely revolutionise healthcare. All the hassle has been removed, and I understand that if a phone call or video call is not enough, patients can be referred for an in-person appointment. Brilliant.",4.20.3
Great Britain,04/18/2020,width: 99%;,"Hi 
I think Babylon is very useful and thoughtful, it benefits a lot of people specially the ones who need medical most",4.20.2
Great Britain,04/18/2020,width: 19%;,"I was very impressed by how easy it was to book an appointment with a GP. I got an appointment at my preferred time, at very short notice. The consultations also went very smoothly. 
There are however a few glitches in the process (or app) that could be improved. Firstly, I was told that my ID papers had been verified and that I was all set to go. However, after my consultation I was informed that this was not the case and I had to contact the helpline. 
As a result my prescription as not released, causing a delay. 
When this was resolved I was told I needed another GP appointment in order to reissue the initial prescription. I do not know why this would be necessary. 
Scheduling another appointment was easy but of course leads to further delays. 
When the 2nd appointment was completed and and prescription reissued, I selected a pharmacy nearby where the prescription would be sent to. 
Having waited another day, the prescription never arrived. 
It is not clear why the prescription was not sent to the pharmacy, but regardless of the reason, there was nothing to alert me or Babylon that the prescription was not issued/never received. 
After another delay and call to the helpline, I finally managed to find another pharmacy. I asked Babylon to send the prescription here, but to no avail. When I again called the helpline I was told Babylon didn’t have a fax number for this pharmacy. Why was I not contacted and made aware of this - or simply call the pharmacy to ask for the number? Instead the prescription was stuck in limbo for a 2nd time, causing more delays. 
So whilst the GP appointments seem to work very well, it is of little use until the prescription process is ironed out.",4.20.2
Great Britain,04/17/2020,width: 99%;,Excellent app with amazing doctors who really listen and care. Thank you 😊,4.20.2
Great Britain,04/16/2020,width: 99%;,Great idea. I haven’t been to a GP for months and they are always available. No need to take time off work anymore.,4.20.2
Great Britain,04/16/2020,width: 19%;,Pathetic ..... 3 appointments missed no explanation,4.20.2
Great Britain,04/15/2020,width: 19%;,"We should not forget this is a MEDICAL app, so it should be very carefully designed, organised and thought-through...not at all the case..
Buggy and problematic - had appointment cancellation one hour before the appointment, after waiting 3weeks. They blamed it on the app
Unoptimised - lacks important features and thus makes app feel abandoned since 1998.
Relevant basic information not visible between departments, made me loose another appointment.
Lack of basic functions - can’t upload more than one image on condition details..in most cases this makes it absolutely useless.
Inconsistent information received from different employees - makes them look completely unorganised, makes you not trust them.
MOST IMPORTANT: DATA IS NOT CONFIDENTIAL BETWEEN YOU AND THE DOCTOR!!!! Even though they tell you it is, they have proven me it is not, as even the customer service that handled my complaint, had access to sensitive data, in fact to all patient data! I have recordings of the proof and will make it public. This app unfortunately is light years away from being what it portraits to be and honestly what it should be. It is without a doubt A RISK TAKEN FOR ANYONE USING IT!",4.20.2
Great Britain,04/15/2020,width: 19%;,Just keeps coming up ‘error’ every time I try & add my code - it’s a free service if you’re a BUPA member,4.20.2
Great Britain,04/14/2020,width: 19%;,It took eight days from the consultation to the prescription being sent to the pharmacy. When I contacted Babylon to ask for an explanation I was told that it was due to an internal technical issue. No apology was given. I don’t think this is an acceptable timescale or attitude given that the company is dealing with people’s health.,4.20.2
Great Britain,04/14/2020,width: 99%;,"I’m not sure what the people were expecting that have written bad reviews? Some are laughable at what there expecting a doctor on the other side of the phone to be able to do. There’s only so much they can do 😂

But my personal opinion is this app is amazing, every time I’ve used this service for myself and son they have been extremely helpful especially when I’ve not been able to get my son out the house

Thank you for being there when I’ve needed you!

Only one minor downside I would say was that I was on a weekend away and my son was at home with his daddy but the doctor wouldn’t call my partner to discuss my sons problem even though he is on my account, could have still done identity checks over the phone, passports et ? But wasn’t the end of the world 

Thanks again for a great app",4.20.1
Great Britain,04/13/2020,width: 99%;,"Did symptom checker, advised to book Appt, so booked online, and was called back. Doctor was great. Happy.",4.20.1
Great Britain,04/13/2020,width: 79%;,"Overall the app is excellent. One small gripe, when entering credit card details, the app (unusually) needs a four digit expiry year. Entering just two digits leaves the ‘add’ button greyed out.",4.20.1
Great Britain,04/12/2020,width: 99%;,"I’m a busy person, Babylon is the perfect way for me to balance being sick",4.20.1
Great Britain,04/11/2020,width: 19%;,"Rubbish dangerous app that will try and remove everything ai on line and doctors this app was developed by members of Boris Johnsons mps in the uk 
Warning the uk government is pushing this app.
If you do the research who run this company ceo. You will see",4.20.1
Great Britain,04/11/2020,width: 99%;,"Like many, I am reluctant to call my GP in the early stages of starting to feel unwell. Having this AI to do a first check is very helpful. It gives a home treatment plan where appropriate and then signs to watch for that medical help may be in fact be required. It helps relax me and guide me. Good tool.",4.20.1
Great Britain,04/11/2020,width: 79%;,"The GP called somewhere between 5 and 10 mins later than the booked time but that’s not by any means unreasonably late compared with my memories of appointments at my local surgery. First attempt had no sound in either direction but the doctor “hung up” and tried again and the second attempt was fine. Video and sound perfectly good enough for the purpose. A couple of minutes after completing the call my prescription came through. I selected to send it to my local Boots. The app indicated that it had been sent but I wasn’t sure if I still needed to wait for a separate notification that it was ready to pick up. Nothing arrived in the app for at least another 30 mins so I went to Boots in the hope it was there. They had no record of the prescription. Thankfully one of their (brilliant) pharmacy team called the Babylon number, confirmed the prescription was legitimate and that the hold up was it needed to be faxed! That came as a surprise to us both: Nice modern video consultantation relying on faxes - technology from the 19th century! Not quite what I expected. However all resolved within about 30 minutes so overall much more convenient than fighting for an appointment - even a telephone consultation from my local surgery, which is closed at the weekends in any case. I am fortunate that the service is provided as a benefit with the BUPA cover from my employer. I would have to understand the charging structure to know whether I would use this on the app’s “pay-as-you-go” scheme has that not been the case.",4.20.1
Great Britain,04/11/2020,width: 39%;,"You’re unable to buy test kits via the app anymore and it also seems to hide certain options unless you switch your membership type between “Babylon” and your GP. Apps functionality is rather disappointing, the only decent thing is booking your appointments but that’s hardly rocket science in an app.",4.20.1
Great Britain,04/10/2020,width: 39%;,"Booking an appointment was easy. I had one within 1/2 hr of logging in. The Doctor was great.
The prescription service is awful.  It relies on the pharmacy having a fax. I rang the pharmacy I had selected as suggested, this was to check they had received my prescription. 
They hadn’t as they don’t have a fax (who does these days).
I called Customer support they says they’d call the pharmacy and call me back. 45 mins later I still haven’t heard. The pharmacy closes in 15 mins. Far from perfect situation",4.20.1
Great Britain,04/10/2020,width: 99%;,Very helpful and trustworthy during this difficult time.,4.20.1
Great Britain,04/10/2020,width: 99%;,"Fantastic service, because it’s easy to use, with the ability to speak and face time with a specialist, to understand the best next steps. This should be a core service if the NHS.",4.20.1
Great Britain,04/10/2020,width: 59%;,The app is great however it is missing support for iPad,4.20.1
Great Britain,04/09/2020,width: 99%;,This has been invaluable to me since moving to London a year ago. I’ve never had a bad experience and I’ve been unwell a lot. Would definitely recommend gp at hand and Babylon!,4.20.1
Great Britain,04/08/2020,width: 39%;,"App is very buggy, lots of issues with the calls, not coming through, not being able to hear or see the physician.",4.20.1
Great Britain,04/08/2020,width: 99%;,"The GP at hand is a no brainer for any Londoners since its part of the NHS. I would usually have to wait between 4-8 weeks for an appointment at my busy London GP, but since I moved over to Babylon’s GP at hand service, I don’t wait more than an hour!! It’s faster than 111 and nearly all of the GP’s I have spoken to are absolutely incredible. Would definitely recommend, even if you have to pay!",4.20.0
Great Britain,04/07/2020,width: 39%;,The app just cancelled my appointment with no explanation/reason why. There’s no way for me to get in touch with someone to find out why either.,4.20.0
Great Britain,04/06/2020,width: 99%;,I can finally make time to see my GP I’m so happy about this.,4.20.0
Great Britain,04/05/2020,width: 99%;,Such a helpful addition to NHS services,4.20.0
Great Britain,04/04/2020,width: 99%;,Fantastic app for me and my family!,4.20.0
Great Britain,04/04/2020,width: 19%;,Horrible user experience. Crashes a lot. Unable to add family member so unable to book appointments. Useless app.,4.20.0
Great Britain,04/03/2020,width: 19%;,"They take the money for an appointment and then don’t provide the service.  When you then ask for a refund they don’t actually send you the money. Shocking service and woeful customer service. 
Would suggest literally any other service",4.20.0
Great Britain,04/03/2020,width: 59%;,Amazing app with great access to doctors any time. Their prescription service relies on fax machines though (which not many places have!) so getting a prescription is really hard work. Not what you need when you’re sick and standing in a pharmacy for 45 mins trying to call Babylon Helpdesk.,4.20.0
Ireland,04/02/2020,width: 99%;,"So convenient, love this app!support team on help desk are really nice and helpful, doctors are so friendly and professional ,consultations are thorough and easy to navigate!and cost effective for minor things !!would highly recommend!!!",-
Great Britain,04/02/2020,width: 99%;,Time to take charge of your own health and this platform allows you to ensure both physical and mental wellbeing,4.18.3
Great Britain,04/02/2020,width: 99%;,"You can have appointments anywhere as long as you have your phone

Great if you move around a lot

High quality professionals.",4.18.3
Great Britain,03/30/2020,width: 19%;,"After about 30 attempts entering my corporate membership number, I’ve given up.",4.18.3
Great Britain,03/28/2020,width: 99%;,No hassle and the GPS are always helpful and attentive! Worth it for the convenience!,4.18.3
Great Britain,03/28/2020,width: 19%;,"Regret signing up to this service as found doctors are not very pleasant, supportive or helpful. 

Used this option as secondary to my GP but I find I definitely get a better service with GP so can’t see the point of paying extra a year for this level of service.",4.18.3
Japan,03/26/2020,width: 19%;,Doesn’t work. Too buggy. Horrible idea. DON’T download!,-
Great Britain,03/26/2020,width: 99%;,Ion glad I’m able to use the app and contact my general practitioner in the comfort of my home. Superb app that other Gp services need to take up,4.18.2
Great Britain,03/25/2020,width: 99%;,"I’m so glad I took the leap to GP at hand. I moved because working in the city it was ridiculous trying to call a doctor at 8am (when I would already be at on on the way to work) for an appointment that day. But aside from ease of booking the service is so much better. I can slip into a meeting room at work for an appointment, the prescriptions are simple and fast, but best of all, the doctors are kind, attentive and take me and my health seriously. I have also visited a couple of the centres when an in person appointment was needed and this worked fine too.",4.18.1
Great Britain,03/25/2020,width: 99%;,The most useful and helpful service I’ve ever experienced - the NHS are onto something that could help millions - especially in the global health crisis such as the one we’re currently in...thank you!,4.18.1
Great Britain,03/23/2020,width: 39%;,This service only works if you have a simply issue. The team I’m the background buckle on the simplest of requests otherwise. Leaving you in distress and sometimes without medication you are unable to just stop. It is a dangerous place to leave people.,4.18.1
Great Britain,03/23/2020,width: 19%;,The AI chatbot provides wrong and unsafe information. The data protection policy is abysmal. Use at your own risk.,4.18.1
Great Britain,03/23/2020,width: 99%;,"Knowing you can talk to a GP online while we are stuck at home during this social distancing period is priceless! 
Will recommend the app to my family and friends who are freaking out about covid-19",4.18.1
Great Britain,03/22/2020,width: 19%;,"I needed an urgent appointment but all the doctors I saw look less experienced. I was misdiagnosed by Babylon Health long time ago and taken to the emergency service. The quality of doctors looks still terrible.

Don’t book appointments with them - even when you notice that Babylon Health allocates a Doctor without decent experience, you can’t get the refund fees.",4.18.1
Great Britain,03/22/2020,width: 59%;,"Had my first appointment this week. Doctor promised to send email with plan for follow up but never received. Also could not prescribe schedule 4 anxiety medication, which was disappointing. I would consider using again but only if I cannot make it to see a GP in person for something like antibiotics. 

Also for the developers of the app - it’s extremely frustrating that the iOS app clears data each time you minimise eg.. if you’re almost finished booking your appointment and want to double check your phone number when you minimise the app it wipes everything so when you come back in you have to start again. Maybe put a 30 second timer on it? Just a thought.",4.18.1
Great Britain,03/22/2020,width: 19%;,"I am in distress and need help and you have rejected my consultation because you can not process my driving licence details quickly enough!
Shame on you, you should not be in this business even for a second!",4.18.1
Singapore,03/21/2020,width: 19%;,Have rhinitis but the app told me that I have sepsis and should go to A&E via ambulance. Incompetent.,-
Great Britain,03/21/2020,width: 99%;,Especially if you are deaf like me strongly recommended application,4.18.1
Great Britain,03/21/2020,width: 99%;,I got an appointment within hours of booking. This service is a life changer,4.18.1
Great Britain,03/20/2020,width: 99%;,"I cannot say enough good things about Babylon. I always feel reassured by their GPS, service is amazing. Worth every single penny and more. Love you guys - keep doing what you’re doing. Ali Parsa - what an amazing company you have built!",4.18.1
Great Britain,03/20/2020,width: 99%;,"Due to crazy working hours, I can rarely leave the office to get the doctors. With Babylon, I can often get an appointment within the hour and the doctors are always amazing and so helpful! I’m so happy knowing I have this service.",4.18.1
Great Britain,03/19/2020,width: 19%;,"Rubbish dangerous app that will try and remove everything ai on line and doctors this app was developed by members of Boris Johnsons mps in the uk 
Warning the uk government is pushing this app.
If you do the research who run this company ceo. You will see",4.18.0
