Country,Date,Rating,Review,Version
Germany,03/19/2020,width: 19%;,"First time attempting to speak with a GP. Chose an appointment at crazy hours, because that’s what was left (that’s my problem, not the app). Waited for the phone all, but it didn’t happen. There was no communication around a delay. Waited some more and emailed Babylon. Went back into the app and a pop up told me the appointment had been cancelled (in a back announcing kinda way). So I booked the next available appointment which was 20 mins later, and now I’m still waiting. No call, no contact about a delay (not even a backannounced cancellation). I wanted to love it, but it’s done so badly. Total waste of time :(",4.18.1
Great Britain,03/18/2020,width: 99%;,"Great service , reassuring and easy to use. Had a wonderful call from a great doctor who made you feel important and they were so knowledgeable and helpful .",4.18.0
Switzerland,03/16/2020,width: 79%;,efficient way to have GP !,-
Great Britain,03/15/2020,width: 99%;,Very helpful. Love it,4.18.0
Great Britain,03/15/2020,width: 99%;,All go surgeries should work like this.  Truest brilliant,4.18.0
Great Britain,03/14/2020,width: 99%;,I love Babylon GP at hand. Have told all my friends to sign up. Being able to log into the app and book an appointment immediately means I get great quality care quickly at the times I need it.,4.18.0
Great Britain,03/14/2020,width: 99%;,"For me, I’ve haven’t had any issues with Babylon or GP at hand. It’s been very easy each time and I find the clinicians very polite, punctual and very attentive. I have had one referral for a treatment and the hospital were a bit useless but the staff at Babylon really went out of their way to help me to get in touch with the ward. I would honestly recommend this service if you are someone who is relatively healthy but has a few issues now and then. I’m asthmatic too so need a repeat prescription which is also very easy through the app.",4.18.0
Great Britain,03/13/2020,width: 59%;,"I loved the idea of this app, I’ve had it around 4 months now and it’s been useful to get quick attention for my mental health. 

There are other conditions that I’ve needed medicine for however and I’ve been told I need to go to a GP. 

The reason I got this app was because my surgery is so awful and getting an appointment is only doable by grappling with everyone else at 8:30 in the morning and hoping to get through to the receptionist to get an appointment for that day, none in advanced. Which isn’t great for a working life. The way this app still has to lean on the NHS is disappointing as I thought I’d be getting an alternative. 

I really hope it tries to decouple itself more from it and becomes less reliant on having to go to GPs.

Also one thing that was never made clear to me was, you will pay varying rates for you prescriptions. I paid £3-£5 for my prescriptions in the north, I then moved south and was spending £40-£60 for the same prescriptions, the prices vary at different pharmacies. Beware of this.

The way this app sends prescriptions to pharmacies when you’re issued them is by Fax (yes they’re still using them!) so often you still need to wait at pharmacies to collect orders as the ones I’ve encountered just don’t take any notice of them.",4.18.0
Great Britain,03/13/2020,width: 99%;,So amazing!!!,4.18.0
Great Britain,03/13/2020,width: 19%;,"Do not register with them. Time wasters! 
They don’t do anything at all everything just gets thrown back and forth between different doctors.",4.18.0
Great Britain,03/13/2020,width: 19%;,"The app is great, up to a point. 
When you need anything more than an over the phone appointment the service really fails. 
The hours are incredibly inflexible, and the surgeries really hard to find. 
I was five mins late and was turned away, I got this app because I work 12 hour days- I had to take time off work to get there. 
It’s really disappointing, I needed to get blood work done- and five minutes seems a bit steep to cut me off. 
Very “computer says no” and ignores like the human side of interacting with people.",4.18.0
Great Britain,03/13/2020,width: 99%;,I find this to be one of the best applications out there . It makes everything so much easier for both parties having the feature with video call as well. Sometimes due to different reasons it’s hard to leave the comfort of your house but with -GP at hand- you can have your own private consultation right inside your room .,4.18.0
Great Britain,03/13/2020,width: 19%;,They cancelled my face to face appointment without even giving an explicit explanation. I took half day off to be able to attend this appointment. This is very frustrating.,4.18.0
