Country,Date,Rating,Review,Version
Great Britain,06/08/2020,width: 39%;,"It’s not great, after verifying ID it keeps asking for the same information. You can add family members but they have to set up the App on their own phone to book appointments. The App gets confused over additional ID, you can’t see where you have already booked an appointment with your GP and it’s not very user friendly.",4.22.0
Great Britain,06/08/2020,width: 19%;,Don’t waste your time,-
Great Britain,06/06/2020,width: 99%;,"Best thing I ever did was swap to Babylon. In the past I have massively struggled to get an appointment at my local practice and when I did, I would normally have to wait almost an hour to be seen. This app is so convenient, truly lives up to it’s ‘at hand’ name. You can always get an appointment which really takes the stress out of being ill and getting a prescription has never been easier.",4.22.0
Great Britain,06/06/2020,width: 99%;,"Clearly much investment has gone into this app and the infrastructure/services behind it.  I use this through Bupa, whereas my wife who is on NHS only, would have to forego her local GP registration to sign up.  There are pros and cons to doing that, but the app remains excellent for ease of use and facilities.",4.22.0
Great Britain,06/05/2020,width: 19%;,"Staffed by brand new baby GPs with no ability to do risk assessment and a tick box mentality. ‘But my flowchart says .....’ 
Terrible. Impossible to get repeat predictions set up (they want to keep making you book appointments as that increases payments) and you only get a 3 day window between scrips so if your can’t get to the chemist, well that’s just too bad. Now need to figure out how to get a proper GP instead of this investor focussed non patient-centric rubbish. Would give zero stars if I could.",4.22.0
Great Britain,06/04/2020,width: 99%;,It’s genuinely so easy to speak to a GP. In the COVID world it’s been invaluable!,4.22.0
Great Britain,06/04/2020,width: 19%;,Trying to register all morning but it keeps returning an error. Pretty poor when you are in pain!,4.22.0
Great Britain,06/04/2020,width: 19%;,If zero was possible I would choose it,4.22.0
Great Britain,06/03/2020,width: 99%;,Would recommend,4.22.0
Great Britain,06/03/2020,width: 19%;,"Appalling service , now waited 3 weeks not connect no explaination",4.20.8
Great Britain,06/02/2020,width: 19%;,Whilst paying for full cover I ended up paying for a doctors appointment I was given a prescription this did not come through and I had to spend time calling the helpline which I still did not receive my medication.,4.22.0
Great Britain,06/02/2020,width: 99%;,This artificial intelligence Technology is a game changer!,4.22.0
Great Britain,06/02/2020,width: 99%;,"Thank you for a very accessible health app. Can’t wait to see if you open up an NHS doctor here in Brighton. For me, London would be too far to travel, especially if unwell.",4.22.0
Great Britain,06/02/2020,width: 19%;,Waited and waited but the call from the doc never came. Will book myself a f2f appt instead,4.22.0
Great Britain,06/02/2020,width: 19%;,"Constantly get cut off when you are you lucky enough to get through. Despite being no 1 in the queue , suddenly it changes to a number further up in the queue. Ordered an antibody testing kit on 19th May big it still hasn’t arrived.",4.22.0
Great Britain,06/02/2020,width: 19%;,They stated dispatched twice ....both times the lied,4.20.8
Great Britain,06/01/2020,width: 19%;,"I was sent warnings one hour , and ten minutes before the appointment - which was scheduled for 9.30 . At 09.21 I was informed that I had cancelled .

This is totally unacceptable .",4.22.0
Great Britain,06/01/2020,width: 19%;,"Appalling service re covid antibody test. Ordered 2 weeks ago, still not received. Tried to cancel and after 48h have been asked to confirm my details - which they could have got from my email address and order number.
Reporting to bank card as fraud.",4.22.0
Great Britain,06/01/2020,width: 19%;,"Twice I’ve logged a call and still nothing, it says if the call is late, I will be notified, but I haven’t and it’s 20 mins late.",4.22.0
Great Britain,05/31/2020,width: 99%;,"Easy to use app, gets you what you need without queuing in long waiting lines. 

This app has really digitised and have put essential healthcare in the palm of our hands

Thank you Babylon.",4.22.0
Great Britain,05/31/2020,width: 99%;,"A joy to video chat with the gp - fast and painless. You do have to follow up with clinical appointments such as blood tests with the call centre after speaking to the GP, and that does not always go to plan with a recent appointment cancelled on the date due to a booking error. That kind of (rare) thing aside, I love it.",4.22.0
Great Britain,05/30/2020,width: 19%;,"I’ve just had a conversation with a pleasant clinician. The issue is - I am struggling to stop smoking (I am trying to get pregnant) and asked for medication to be prescribed in order to stop. I was advised it was not possible to prescribe Champix/similar due to monitoring required. Whilst I understand the process,  it was understood Babylon service will be able to assist with matters as such.  After my call I will now need to contact me HNS GP and ask for the same, which contradicts  the point of having a private GP.

Babylon Service is paid for, yet there’s no resolution In the end.",4.22.0
Great Britain,05/30/2020,width: 99%;,"This has completely elevated my healthcare. It’s prompt, reliable and encouraged me to take my health more seriously. I feel genuinely cared for and meet amazing nurses and doctors. It’s define my worth it. 

I have visited one of their clinics too and it so clean, beautifully designed. The people once again were amazing and it’s just great!!!!!",4.22.0
Great Britain,05/30/2020,width: 99%;,This is a great app.,4.22.0
Great Britain,05/30/2020,width: 99%;,"Love the Babylon app! Perfect for when you need to see someone but can’t get into your GP. And with everything online nowadays anyway, it’s the perfect solution. Had an eye infection and got prescribed antibiotics then and there as she could clearly see the problem on the video app. So happy to have it resolved without having to go to urgent care on a Saturday.",4.20.8
Great Britain,05/29/2020,width: 19%;,"The app does not recognise my company pin.
So had to call the helpline. Went backwards in queuing system from 12th to 22nd. 
Requested a Call back but does not recognise if you give an alternative number. 
The service with the doctor was great. The rest is awful.",4.22.0
Great Britain,05/29/2020,width: 99%;,I have been so impressed with Babylon and how friendly and helpful everyone is.,4.22.0
Great Britain,05/28/2020,width: 19%;,"Absolutely shameful! I ordered a SARS-CoV2 antibody test, told two different dispatch dates, still not arrived and now told that the results won’t be released and haven’t been able to arrange a refund. Awful customer service for a product miss sold!",4.20.8
Great Britain,05/28/2020,width: 19%;,I strongly recommend you do not pay any money to this app as the capacity of the company to fulfil or communicate with customers is smoke and mirrors,4.20.8
Great Britain,05/27/2020,width: 19%;,"Had appointment booked for 8:50pm. Received a reminder alert and hour before and then again 10 mins before. Now it’s 8:50pm. I waited and waited but no call. I checked my details to ensure they were correct. I checked my emails - just in case. Nothing. Complete waste of time. No comms as to why the doctor didn’t call. My internet connection is high speed broadband and my mobile provider is EE and I have excellent connections. I can only assume that the doctor read my medical notes and decided it wasn’t worth their time. My health may not be important to them, but it is to me. Stick to NHS. Don’t waste your time with Babylon. It’s a con!",4.20.8
Great Britain,05/27/2020,width: 19%;,"App states 24/7 service. Booked an appointment at 3pm but was only able to get a confirmed appointment for the following day. The appointment was then cancelled with no explanation 1 hour later, yet they took payment. Once I reached out they explained that the doctor was t feeling well? I expressed to the support team that this was disappointing to which she replied is there anything else I can help you with. I thought this would be easy and seamless but seriously would not recommend.",4.20.8
Great Britain,05/27/2020,width: 99%;,"I think Babylon really suits me as a young person particularly, as it’s really easy to get an appointment exactly when you want it and pick up prescriptions nearby. Both practitioners I have seen from Babylon have been really great and helped me lots. Thank you Babylon!",4.20.8
Great Britain,05/27/2020,width: 99%;,"Excellent service - registered yesterday afternoon, which was a quick and easy process and had my appointment this morning.",4.20.8
Great Britain,05/27/2020,width: 19%;,The COVID-19 antibody is a SCAM! I want a refund.,4.20.8
Great Britain,05/27/2020,width: 19%;,"I ordered the Covid Antibody test on May 16th. The App told me it was dispatched Monday May 18th. After 5 working days it had not arrived. As instructed for non delivery on the app, I contacted Babylon, was offered a call back option to avoid waiting in the queue, which I took. No one called back. I called again and waited in the queue and was told to wait another 3 days. Today, Wednesday 27th, the test kit had not been delivered. I called Babylon midday, half way through the call I was disconnected. 
I called Babylon again at about 6pm, joined the queue at position 11.  Then moved to 12 and then 13. I then moved up to 9. Only to go back to 10 and then 11 in the queue. What kind of queuing system is that?
Finally I got through and spoke to a very helpful man in the call centre. It took him some time to find my account details - I had to e mail him an e mail I had received from Babylon to help him. I also went into the app to try and help him find my account. Then I saw that since Friday 22nd, the despatch date for the test had been moved from Monday 18th to Thursday 21st. The man in the call centre said his system showed the despatch date was Friday the 21st. What is going on? How can despatch dates be changed in you system AFTER the original despatch date. How can the system show one date on the app and another date in your call centre?

How can I have confidence in the integrity of test process? This is not a rhetorical question. These are not unimportant tests. This is not the level of integrity I expected from Babylon nor from any company offering health services at any time, let alone a time like this.",4.20.6
Germany,05/27/2020,width: 19%;,Just taken your money,-
Brazil,05/27/2020,width: 99%;,Excelente,-
Great Britain,05/26/2020,width: 99%;,Amazing app can see and talk to GP or medical professionals at any time.,4.20.8
Great Britain,05/26/2020,width: 19%;,"I purchased a covid 19 antibody test 11 days ago and despite being told it was shipped and royal mails problem I still have not received it . I have received multiple items from royal in 24 hours so this is completely untrue. No despatch,  shipping or tracking information provided at all. I have ordered a test with a high street retailer . Much more reliable ! AVOID!",4.20.8
Great Britain,05/26/2020,width: 19%;,Sold a COVID test. Still not arrived despite it being stated it would take no longer than 5 working days. Constant spam mail from them everyday,4.20.8
Great Britain,05/26/2020,width: 19%;,Paid for an antibody test. Ap said despatched Mon 18 May. Still no test Friday 22 May. Told to wait another week because delivery problems. Didn’t offer to check where it was with couriers. Promised to escalate. Nothing. No response to email and no complaints procedure. Still no test. Government have now halted lab testing for these kits. Still no response. Thankfully paid on a credit card.,4.20.5
Great Britain,05/25/2020,width: 99%;,Excellent feedback. Dr called on time and although the video option did work (it really wasn’t necessary) consultation was excellent with prescription advised. First class service,4.20.7
Great Britain,05/25/2020,width: 19%;,Avoid. Deliveries are unreliable. Says dispatched then a week later they change there mind,4.20.7
Great Britain,05/25/2020,width: 19%;,All goes well till appointment - but thereafter medicine collection is a pain every time,4.20.7
Great Britain,05/24/2020,width: 19%;,Glitchy And unusable,4.20.7
Great Britain,05/24/2020,width: 99%;,"I can only recommend, it’s really good and fast and reliable",4.20.7
Great Britain,05/24/2020,width: 19%;,I haven’t received the test kit I ordered 5 days ago. Just heard that Abbott do not endorse your test. So please provide me with a refund. What a SCAM!,4.20.7
Great Britain,05/23/2020,width: 19%;,Ordered a test kit from them told it was dispatched only to find later that they had changed the status back to processing. Dishonest at best and would certainly not trust such a company with my health or GP matter. Best avoided,4.20.7
Great Britain,05/23/2020,width: 19%;,I fainted and was waiting for this appointment all day. She didn’t call or even bothered to cancel. Disgraceful.,4.20.7
Great Britain,05/23/2020,width: 39%;,Application keep syncing all the time with Apple Watch and Health App.,4.20.7
Great Britain,05/22/2020,width: 19%;,No point having a snazzy app if you can’t deliver services,4.20.7
Great Britain,05/22/2020,width: 99%;,Used to not go to the doctors when unwell and always missed repeat prescription orders as the waiting times were so long. This has changed the game.,4.20.7
Great Britain,05/22/2020,width: 19%;,So it turns out that this test is not approved by Abbott and the use of Abbott’s name in Babylon information materials has not been authorised by Abbott either.,4.20.7
Great Britain,05/22/2020,width: 19%;,"Go through the whole verification process and get the message that the account is now verified, then the verify my account banner is still there and asking me to start the process again! Tried to add two different cards as payment methods and got the error “something went wrong” both times. Really helpful error message there! Don’t waste your time with this app.",4.20.7
Great Britain,05/22/2020,width: 19%;,My booked appointment was cancelled and booked at a time I would be busy without consulting me first.,4.20.7
Great Britain,05/22/2020,width: 99%;,Love the app has made it so much easier to obtain healthcare and manage my anxiety.,4.20.7
Great Britain,05/20/2020,width: 19%;,"Why is Babylon marketing test kits when Government advice is not to use them, they are unproven....? A disgrace, I’ve deleted my Babylon app and requesting deletion of all data held by them on me. I have to rate this review 1 star to get it posted, otherwise it would be zero.",4.20.7
Great Britain,05/20/2020,width: 39%;,Not user friendly and most of patients docs like lab test results are not sent on the app.,4.20.7
Great Britain,05/20/2020,width: 19%;,"I had blood tests done 4-5 weeks ago. I am still waiting for the results. When I first enquired about my test results I was told they would be emailed or posted. 
First the Babylon doctor did not request the full thyroid panel and now I don’t even receive the test. 
Pathetic.",4.20.7
Great Britain,05/20/2020,width: 99%;,"Very pleased with the service I have been given. It’s easy, efficient and effective. Especially during the current Covid-19 challenges. Every dr I have seen have been professional and understanding of medical complaints. Very glad I signed up for this service and have already recommended to friends and colleagues.",4.20.7
Great Britain,05/20/2020,width: 19%;,"They can’t send prescription by email. 
Poor service.",4.20.6
Great Britain,05/20/2020,width: 19%;,"I bought a test kit but there was no option for next day delivery. Seems ridiculous - can’t think of a situation where someone is willing to pay £70 for a test, but not bothered about how quickly they get the results. 5 days later, still waiting for my test",4.20.5
Great Britain,05/19/2020,width: 19%;,My initial GP appointment identified a need for a physiotherapist—called BUPA & got lots of contacts- however they are only doing video/telephone consultation as apparently they are in a high risk role - would have saved me a lot of time had I known that in the first place!,4.20.5
Great Britain,05/18/2020,width: 19%;,Tried to get an appointment for my daughter. The app would not recognise the code provided by BUPA. By the time this was resolved I had to wait another 3 hours for an appointment. Not great for a 4 year old. Ended up going the normal GP route and would not recommend this at all.,4.20.6
Great Britain,05/18/2020,width: 79%;,The only thing missing is being able to book a follow up appointment with the same doctor. I want to be able to book follow ups with doctors I’ve already seen. Not to always book with a new doctor. Thanks.,4.20.6
Great Britain,05/18/2020,width: 99%;,"Book with GP take ages to get appointment and Babylon is very good and can be done within hours or next day. 

I book it yesterday, Sunday most GP closed. But this Babylon was open. 

Suggust to use FaceTime preferably that Skype cos Skype can get frozen. 

Excellent service. 

Thanks 

John",4.20.6
Great Britain,05/18/2020,width: 99%;,Best app of UK,4.20.6
Great Britain,05/18/2020,width: 19%;,"I used the GP service to get a prescription for some eye drops. I’m pregnant and so have a prescription charge exemption certificate. On taking the prescription to be filled at the pharmacy I was told there was a £47 charge and exemption did not apply. £47 for eye drops is absolutely disgusting and at no point was I informed before getting the prescription filled that there would be an additional charge. Considering I pay for private health care and the Babylon GP service, I was absolutely disgusted that I then had to pay nearly £50 to have my prescription filled. I will NEVER be ordering another private prescription through Babylon again. The only reason I used the service in the first place was because it was on the weekend. I would have waited until Monday morning if I’d have known about the appalling extortionate fee. Absolutely disgusting. I actually can’t express how angry I am about this.",4.20.3
Great Britain,05/18/2020,width: 19%;,"Software itself is good but the quality of the doctors is poor in my opinion. Devoid of any humanity, the doctors power through as many appointments as possible without much interest in your actual problem.",-
Great Britain,05/18/2020,width: 39%;,"Software itself is good but the quality of the doctors is poor in my opinion. Devoid of any humanity, the doctors power through as many appointments as possible without much interest in your actual problem.",-
Great Britain,05/17/2020,width: 99%;,Really good,4.20.6
Great Britain,05/16/2020,width: 99%;,"Excellent app, allowing you to put your allergies and current medication on so you don’t have to go through the process when getting medical help. You are able to put your preferred pharmacy too, and prescription was sent quickly to them. Have used twice and in both occasions the GP and pharmacist were professional and friendly. Highly recommend",4.20.6
Great Britain,05/16/2020,width: 99%;,Easily able to have a video or voice call with a doctor or nurse. They are very helpful and this service is much more convenient.,4.20.6
Great Britain,05/15/2020,width: 19%;,Membership code is not working for my family dependents!?,4.20.6
Great Britain,05/15/2020,width: 59%;,Just moved from my previous physical GP and I have no access to my medical history.,4.20.6
Great Britain,05/15/2020,width: 19%;,Am trying to order a test kit and app crashes,4.20.5
Great Britain,05/15/2020,width: 19%;,"Impossible to deal with “family member”. Asked constantly to verify even when already verified several times! 
Impossible to get membership code.",4.20.5
Great Britain,05/14/2020,width: 99%;,"User-friendly and easy to visualise info.
This app looks after ita patients.",4.20.4
Great Britain,05/13/2020,width: 99%;,"I was initially not impressed with the fact that you can’t see your GP in person and I put off using the app for a long time despite my files being transported to Babylon. I used it for the first time during COVID-19 and I am so impressed. Not only no travel time, but also the gps are so helpful and sympathetic, got my prescription within an hour from the pharmacy across the road from my home. I LOVE THIS APP, such a life saver when you need urgent care.",4.20.4
Great Britain,05/13/2020,width: 59%;,Old fashioned phone app - is not really suitable for IPads,4.20.4
Great Britain,05/09/2020,width: 99%;,"They’ve been very helpful and attentive, they’ve tested me broadly and efficiently and never fail to deliver care",4.20.3
India,05/08/2020,width: 19%;,"Hello, I’ve had a really positive experience interacting with Martha and Adam at customer service and tech support as well as with Dr Rebecca Towsey who prescribed my usual medication. However, the pharmacist Dionne refuses to take the Bablylon doctor’s prescription, check records and notes of our video call as well as records from my previous GP to action it. Adam has been coordinating all day and promisedI will receive a call back from the pharmacy. On the contrary, I’ve had no call backs and now supposedly have a new appointment for Monday. I do not understand why the previous doctor’s prescription is not enough. I do not appreciate the pharmacist’s tone to my not being a UK citizen. I provided an international prescription for her records with the hope that she can also check my previous NHS records. I have been in the country for 10 years and am a Fellow at the LSE. This is unacceptable behaviour.",-
Great Britain,05/08/2020,width: 99%;,Had my first GP consultation for an irritable skin condition. The Dr was simply outstanding. Wish I had called much sooner.,4.20.3
Great Britain,05/07/2020,width: 19%;,Won’t accept bupa code,4.20.3
Great Britain,05/07/2020,width: 19%;,I’ve been getting charged for months now. Tried using the service and the appointment didn’t go through. Now £150 in and still having difficulty getting any service.,4.20.3
Great Britain,05/07/2020,width: 99%;,"Fast, competent, so easy. The new way to access the NHS.",4.20.3
Great Britain,05/05/2020,width: 99%;,Really helpful doctor. No time constraints and a great facility,4.20.3
Great Britain,05/05/2020,width: 99%;,"I’ve been a patient with Babylon for a few months now. I wanted to say thank you for the amazing patient care!

Having fast access to a friendly and professional GP via the Babylon app has always been a good experience and any prescriptions or referrals have been handled efficiently. When I did need to see a GP face to face (during lockdown), that was managed very well. 

Initially the only negative I’ve experienced was with the administration/back office functions but in the past six weeks that has improved noticeably. 

I am very impressed and have no hesitation in recommending the Babylon GP service to my friends and family. 

Regards,

James Clary",4.20.3
Great Britain,05/04/2020,width: 59%;,"On the whole Babylon is great, really leading the way in telehealth in UK and it’s amazing being able to see a doctor on the day you request. However, I’m leaving a low review because as the title suggests the system for ordering repeat prescriptions is broken and to the best of my knowledge all repeat prescription information has to be requested and updated manually making the functionality, notifications etc useless. I’ve been told that support are aware of this but nothing seems to be working to change it. The NHS’ dated “patient access” system that Babylon wants to replace actually works a lot better for repeat Rx ordering. Please fix this!",4.20.3
Great Britain,05/04/2020,width: 99%;,"The doctors are all great quality, and I never have to go in. If I do it's a hassle but once you are through that getting repeats etc is a doddle.",4.20.3
Great Britain,05/03/2020,width: 99%;,"Thank for your service it is so much easier quicker better than trying to make an appointment with your GP then trying to deal with the receptionist who wants to know why your want to see a GP and two weeks later you get an appointment as if that’s a help. 
With Babylon tape the app make the appointment job done same day you have your speaking to a doctor and if you need meds prescription all sorted and sent to pharmacy of your choice. 
Sorted",4.20.3
Great Britain,05/03/2020,width: 19%;,"20200502
Where’s the much vaunted ‘Appointments’ button? Pretty darn useless without it... 

Past consultations themselves have always been professional but yet remain pointless as we keep being referred back fir a real appointment. 

Doctor = good
App = pony",4.20.3
Great Britain,05/03/2020,width: 19%;,"Video calls have been effective but getting repeat prescriptions is rarely straightforward - reordering is repeatedly met with an error message, resolved - after a 30 min phone call with support. Same issue the next month.",4.20.3
Great Britain,05/03/2020,width: 99%;,"Big thank you to Dr Hijazi and the team.
Took the time to listen to my symptoms and come up with a plan of action.
Prescription en route already to my local pharmacy.🤗
Would recommend this service.
Thank you.
Lee",4.20.3
